{
  "id": "5f0c2a7e-1b3d-4c8e-9a10-000000000003",
  "kind": "cli",
  "entrypoint": "cli",
  "instance": null,
  "account": null,
  "owner": null,
  "host_session_id": null,
  "project": "toys",
  "project_source": "mentions",
  "cwd": "/Users/dev/Projects",
  "branch": null,
  "title": "Compare two toy layouts",
  "summary": null,
  "needs_user": null,
  "first_prompt": "Compare the two layouts in toys/",
  "last_prompt": "Which one is faster?",
  "last_reply": "The grid layout renders in half the time.",
  "prs": [],
  "created": 1791220000000,
  "last": 1791220900000,
  "turns": 3,
  "pid": 51420,
  "started": 1791220000000,
  "status": "busy",
  "status_since": 1791220900000,
  "waiting_for": null,
  "dormant": false,
  "archived": false,
  "outcome": "ok"
}
