{
  "id": "5f0c2a7e-1b3d-4c8e-9a10-000000000002",
  "kind": "code",
  "entrypoint": "claude-desktop",
  "instance": "Claude-personal",
  "account": "0a1b2c3d-0000-4000-8000-000000000001",
  "owner": {
    "data_dir": "/Users/dev/Library/Application Support/Claude-personal",
    "pid": 4188
  },
  "host_session_id": "local_00000000-0000-4000-8000-0000000000a2",
  "project": "toys",
  "project_source": "cwd",
  "cwd": "/Users/dev/Projects/toys",
  "branch": "main",
  "title": "Tidy the toy box",
  "summary": "Waiting to run the formatter",
  "needs_user": true,
  "first_prompt": "Sort the toy list by colour",
  "last_prompt": "Sort the toy list by colour",
  "last_reply": "I'll run the formatter next.",
  "prs": [],
  "created": 1791210000000,
  "last": 1791210300000,
  "turns": 1,
  "pid": 51301,
  "started": 1791210000000,
  "status": "waiting",
  "status_since": 1791210300000,
  "waiting_for": "permission",
  "dormant": false,
  "archived": false,
  "outcome": "ok"
}
